Variant	Deck	Keywords	HP	Nemesis Icon	Innate Power Name	Innate Power Effect	Extra Text	Featured Issue	Incapacitated Caption	Incapacitated Option 1	Incapacitated Option 2	Incapacitated Option 3	Incapacitated Featured Issue	Set	Complexity
Freedom Six	Tempest	Hero	23	Tempest	Sacrifice	POWER: Either draw 1 card or destroy 1 Weather card. If you destroy a card this way, play up to 2 cards.	-		The Last of His Kind	1 Hero takes their PLAY PHASE.	1 Hero discovers 1 Ongoing card.	Each target regains 1 HP.		Disparation	6
Shockwave	Tempest	Hero	24	Tempest	Tagged and Bagged	POWER: Tempest deals 1 target 2 lightning damage. If that target is destroyed, draw 2 cards and Tempest regains 2 HP.	-		Apprehended	1 Hero takes their PLAY PHASE.	Destroy 1 Ongoing card.	Select 1 target. Until your START PHASE, all damage dealt by that target is irreducible lightning damage.		Disparation	6
Base	The Argent Adept	Hero	24	The Argent Adept	Vocalize	POWER: Activate 1 Perform.	-		Virtuoso's Final Note	1 Hero takes their POWER PHASE.	1 target regains 2 HP.	Select 1 damage type. Until your START PHASE, +1 damage dealt of that type by hero targets.		Core Game	10
First Appearance	The Argent Adept	Hero	21	The Argent Adept	Improvise	POWER: Play the top card of your deck. If it is an Ongoing card, activate the Perform on it.	-	Toll of Destiny #1	The Void: Untamed!	1 Hero takes their PLAY PHASE.	1 Hero discovers 1 Ongoing card.	Destroy up to 2 targets with 1 HP.	Toll of Destiny #3	Core Game	-
The Ashen Heir	The Argent Adept	Hero	25	The Argent Adept	Music of the Mists	POWER: Discard the top card of your deck. The Argent Adept deals X targets 2 infernal damage each, where X is the highest numeral in the discarded card's game text. If The Argent Adept is dealt damage this way, activate 1 :perform: Perform.	-		Quieted Whispers	1 Hero takes their POWER PHASE.	Up to 3 targets regain 1 HP each.	Discard the top card of 1 deck. You may destroy 1 non-character card that shares a keyword with the discarded card.		Disparation	10
Base	The Harpy	Hero	29	The Harpy	Seeking Order	POWER: The Harpy deals 1 target 1 infernal damage. Either draw 2 cards or destroy 1 Flock card.	-		The Final Mockery	1 Hero takes their POWER PHASE.	Destroy up to 3 targets with 1 HP each.	Until your START PHASE, -1 damage dealt to all targets.		Rook City Renegades	9
First Appearance	The Harpy	Hero	26	The Harpy	Flailing Chaos	POWER: The Harpy deals 1 target 2 infernal damage. Play the top card of your deck.	-	Dark Watch Vol. 1 #7	Chaos Unmasked	1 Hero takes their PLAY PHASE.	Discover 1 target from 1 deck.	Bury the top card of each trash.	Dark Watch Vol. 1 #12	Rook City Renegades	-
Dark Watch	The Harpy	Hero	27	The Harpy	Nevermore	POWER: Discard 1 card. Summon 1 Cohort card. You may discover 1 Flock card.	-		Recompense	1 Hero takes their POWER PHASE.	Bury 1 Environment card.	Move 1 card from 1 Hero trash to the top of that Hero's deck.		Rook City Renegades	-
Blood Raven	The Harpy	Hero	24	The Harpy	Life Witch	POWER: The Harpy deals 1 target 3 infernal damage. The Harpy regains 2 HP. Destroy 1 Hero Ongoing card.	-		Flee Temptation	1 Hero takes their POWER PHASE.	Bury 1 Environment card.	1 target deals itself 1 infernal damage. If a target is destroyed by that damage, each Hero target regains 1 HP.		Rook City Renegades	-
Base	The Visionary	Hero	24	The Visionary	Motivating Metalism	POWER: 1 Hero draws 2 cards, then discards 1 card. If you drew a card this way, play the top card of the Dark side deck.	Setup: Shuffle and set the Dark side deck in this play area.		Dark Side: Triumphant	1 Hero takes their POWER PHASE.	Destroy 1 Ongoing card.	1 Hero draws 3 cards and discards 2 cards.		Disparation	7
First Appearance	The Visionary	Hero	23	The Visionary	Rend Spacetime	POWER: Draw 1 card. Either The Visionary deals 1 target 1 psychic damage or play the top card of the Dark side deck.	Setup: Shuffle and set the Dark side deck in this play area.	Freedom Five #422	Cocoon Subject	1 Hero takes their POWER PHASE.	1 Hero discovers 1 Ongoing card.	Reveal the top 3 cards of 1 deck. Replace them in any order.	New Memories #5	Disparation	7
Dark	The Visionary	Hero	21	The Visionary	Complete Control	POWER: Discard 2 cards. Draw the top 3 cards of the Dark side deck. You may play 1 Dark card from hand.	Setup: Shuffle and set the Dark side deck in this play area.		Reattuned	1 Hero takes their DRAW PHASE.	Each target deals itself 2 fixed psychic damage.	1 Hero discards their hand, destroys all non-character Hero cards in their play area, draws 4 cards, and plays the top 2 cards of their deck.		Disparation	7
The Fishionary	The Visionary	Hero	20	The Visionary	Little Plastic Mind Castle	POWER: Reveal the top card of your deck and the top card of the Dark side deck. Discard 1 and play the other.	Setup: Shuffle and set the Dark side deck in this play area.		Morsel to GloomBeaver	1 Hero takes their PLAY PHASE.	2 targets regain 2 HP each.	Reveal the top card of the Environment deck. Play it, discard it, or bury it.		Disparation	7
Base	The Wraith	Hero	26	The Wraith	Stealth	POWER: Until your START PHASE, -1 damage to The Wraith.	-		Will Crime Prevail?	1 Hero takes their PLAY PHASE.	Destroy 1 Ongoing card.	1 Hero target regains 2 HP.		Core Game	4
First Appearance	The Wraith	Hero	25	The Wraith	Haunt the Shadows	POWER: Reveal and replace the top card of the Villain deck. If it is a target, discover 1 Item card. Otherwise, draw 1 card.	-	Mystery Comics Vol. 1 #27	A Felonious Foe!	1 Hero takes their DRAW PHASE.	1 Hero summons 1 Item card.	Bury 1 Villain target with 2 or fewer HP.	Mystery Comics Vol. 1 #74	Core Game	-
Detective	The Wraith	Hero	24	The Wraith	Sleuth	POWER: Reveal the top card of 1 deck. You may replace that card, bury that card, or play that card.	-		Some Stones Better Left Unturned	1 Hero takes their DRAW PHASE.	Discard the top of 1 deck.	Discover 1 target from the Villain deck. Set that target to 1 HP.		Rook City Renegades	-
Freedom Six	The Wraith	Hero	27	The Wraith	Price of Freedom	POWER: The Wraith deals up to 2 targets 2 melee damage each. Either discard 2 cards or The Wraith deals herself 2 fixed psychic damage.	-		Out of Knives	1 Hero takes their POWER PHASE.	Destroy 1 Ongoing card.	Select 1 Hero target. Until your START PHASE, +1 damage dealt to and by that target.		Disparation	4
Base	Unity	Hero	26	Unity	Bot Hack	POWER: Destroy 1 Item card. If you do, play or discover 1 Mechanical Golem.	-		Incapable Creator	1 Hero takes their PLAY PHASE.	1 Hero salvages 1 Item card.	The Hero target with the lowest HP regains 3 HP.		Core Game	6
First Appearance	Unity	Hero	24	Unity	Sparks!	POWER: Unity deals 1 target 1 lightning damage. Play the top card of your deck.	-	Freedom Five Annual #11	Not-Tastic...	1 Hero takes their POWER PHASE.	1 Hero takes their DRAW PHASE.	1 Hero discovers 1 Item card.	Freedom Five Annual #12	Core Game	-
Scavenger	Unity	Hero	23	Unity	One Man's Trash	POWER: You may play 1 Mechanical Golem card or Item card from your trash. If you do not, draw 2 cards and discard 1 card.	-		All Tinkered Out	1 Hero takes their POWER PHASE.	Reveal and replace the top card of 1 non-Hero deck.	Destroy 1 target with 2 or fewer HP.		Rook City Renegades	-
Freedom Six	Unity	Hero, Mechanical Golem	22	Unity	Golem-Spawn	POWER: Unity deals herself 3 fixed energy damage. Either play or discover 1 Mechanical Golem card.	-		The Unkind Truth	1 Hero takes their POWER PHASE.	1 Hero discovers 1 Item card.	The target with the lowest HP deals the target with the highest HP 3 energy damage.		Disparation	6