Deck	Side 1 Name	Side 1 Description	Side 1 Keywords	Side 1 HP	Side 1 Nemesis Icon	Side 1 Setup	Side 1 Game Text	Side 1 Advanced	Side 2 Name	Side 2 Description	Side 2 Keywords	Side 2 HP	Side 2 Nemesis Icon	Side 2 Game Text	Side 2 Advanced	Set	Difficulty
The Ennead	Atum	World Finisher	Villain	26	Ra	-	SUN:  Atum deals the Hero Character with the highest HP (H) fire damage.	-	Atum	Incapacitated	-	-	-	HAND:  Destroy 1 Item card. END PHASE If The Sickle of Geb is in play, remove it from the game, then destroy all Environment cards.	-	Disparation	7
The Ennead	Geb	Earthquake Speaker	Villain	29	Ra	-	HAND:  Geb deals each non-Villain target 2 melee damage.	-	Geb	Incapacitated	-	-	-	HAND:  Destroy 1 Ongoing card. END PHASE If The Khopesh of Shu is in play, remove it from the game, then destroy (H) Hero Ongoing and/or Item cards.	-	Disparation	7
The Ennead	Isis	Matriarch of Magic	Villain	25	Ra	-	ANKH:  Isis deals the (H) minus 2 Hero targets with the highest HP 1 radiant and 2 infernal damage each.	-	Isis	Incapacitated	-	-	-	HAND:  The (H) non-Villain targets with the highest HP each deal themselves 1 fixed psychic damage. END PHASE If The Crook and Flail of Osiris is in play, remove it from the game, then flip this card to its active side, restoring it to 9 HP.	-	Disparation	7
The Ennead	Nephthys	Life Warden	Villain	24	Ra	-	ANKH:  The (H) minus 1 non-Villain targets with the lowest HP deal themselves 1 fixed psychic damage each. The (H) minus 1 Villain characters with the lowest HP regain 2 HP each.	-	Nephthys	Incapacitated	-	-	-	ANKH:  Discard the top 2 cards of each Hero deck. END PHASE If The Sun Disc of Isis is in play, remove it from the game, then each Hero target deals itself 2 fixed radiant damage.	-	Disparation	7
The Ennead	Nuit	She Who Protects	Villain	27	Ra	-	SUN:  The Villain character with the lowest HP regains (H) HP.	-	Nuit	Incapacitated	-	-	-	ANKH:  Play the top card of the Environment deck. END PHASE If The Typhonic Rod of Set is in play, remove it from the game, then play the top card of the Environment deck, then play the top card of the Villain deck.	-	Disparation	7
The Ennead	Osiris	Lord of Silence	Villain	23	Ra	-	HAND:  Osiris deals the (H) minus 1 non-Villain targets with the lowest HP 1 infernal damage each.	-	Osiris	Incapacitated	-	-	-	SUN:  1 Hero buries 1 card from their hand. END PHASE If The Shield of Tefnut is in play, remove it from the game, then each Hero discards 2 cards.	-	Disparation	7
The Ennead	Set	God of Storms	Villain	22	Ra	-	ANKH:  Set deals the (H) non-Villain targets with the highest HP 1 lightning damage and 1 cold damage each.	-	Set	Incapacitated	-	-	-	ANKH:  The (H) Villain characters with the lowest HP each regain 1 HP. END PHASE If the Ankh of Nephthys is in play, remove it from the game, then flip 1 incapacitated Villain character card other than this one to its active side and restore it to 9 HP.	-	Disparation	7
The Ennead	Shu	Breath of the Wind	Villain	21	Ra	-	HAND:  Shu deals the Hero character with the lowest HP (H) minus 2 melee damage.	-	Shu	Incapacitated	-	-	-	SUN:  Each Environment target regains 2 HP. END PHASE If The Orb of Nuit is in play, remove it from the game, then each Villain character regains (H) HP.	-	Disparation	7
The Ennead	Tefnut	Warrior of the Flood	Villain	28	Ra	-	SUN:  Tefnut deals the Hero target with the second highest HP (H) minus 1 melee damage.	-	Tefnut	Incapacitated	-	-	-	SUN:  Destroy 1 non-Villain target with 1 HP. END PHASE If The Bracer of Atum is in play, remove it from the game, then each Hero target deals themselves 2 fixed fire damage.	-	Disparation	7